{"$schema":"http://json-schema.org/draft-07/schema#","type":"object","properties":{"version":{"type":"string","const":"0.0.1"},"format":{"type":"string","const":"orf"},"meta":{"type":"object","properties":{"name":{"type":"string"},"sort":{"type":"string"},"sort_order":{"type":"string"},"tags":{"type":"array","items":{"type":"string"}}},"required":["name"]},"data":{"type":"object","properties":{"personal":{"type":"object","properties":{"name":{"type":"string"},"phone_number":{"type":"string"},"email":{"type":"string"},"city":{"type":"string"},"state":{"type":"string"},"country":{"type":"string"},"url_linkedin":{"type":["string","null"]},"url_website":{"type":["string","null"]},"url_portfolio":{"type":["string","null"]},"url_other":{"type":"array","items":["string","null"]}},"required":["name","phone_number","email"]},"summary":{"type":"string"},"education":{"type":"array","items":{"type":"object","properties":{"degree_level":{"type":"string"},"degree_title":{"type":"string"},"completed":{"type":"boolean"},"institution":{"type":"string"},"major":{"type":"string"},"start_year":{"type":"integer"},"end_year":{"type":"integer"}}}},"experience":{"type":"array","items":{"type":"object","properties":{"title":{"type":"string"},"employer":{"type":"string"},"employer_city":{"type":"string"},"description":{"type":"array","items":{"type":"string"}}},"required":["title","employer"]}},"projects":{"type":"array","items":{"type":"object","properties":{"title":{"type":"string"},"url":{"type":"string"},"description":{"type":"array","items":{"type":"string"}}}}}}},"required":["personal"]}}