{
  "version": "0.0.1",
  "format": "orf",
  "meta": {
    "name": "Giacomo Tüfekçi",
    "sort": "chrono",
    "sort_order": "desc",
    "tags": [
      "software-development",
      "web-development",
      "full-stack"
    ]
  },
  "data": {
    "personal": {
      "name": "Giacomo Tüfekçi",
      "phone_number": "",
      "email": "giacomo@tuefekci.de",
      "city": "Ludwigshafen am Rhein",
      "state": "",
      "country": "DE",
      "url_linkedin": "https://www.linkedin.com/in/gtuefekci/",
      "url_website": "https://giacomo.tuefekci.de",
      "url_portfolio": null,
      "url_other": []
    },
    "summary": "I'm a Full-Stack Developer based in Ludwigshafen am Rhein, Germany, with a background in web development, software engineering, and game design. I enjoy building end-to-end solutions and working seamlessly across various programming languages and web frameworks. Beyond just writing code, I value strong project management to ensure ideas actually make it to production efficiently and on time. When I’m not at my keyboard, I’m usually tinkering with electronics, keeping up with new tech, or tending to my garden. I also enjoy winding down with gaming, anime, and web novels. I speak fluent German and English, and I always aim to bring a practical, creative approach to the software I build.",
    "education": [
      {
        "degree_level": "other",
        "degree_title": "journeyman's certificate, specialized in Design and Technology",
        "completed": true,
        "institution": "Wilhelm Wagenfeld-Schule",
        "institution_city": "",
        "institution_state": "",
        "major": "Media Designer",
        "concentration": null,
        "minor": null,
        "gpa": null,
        "gpa_scale": null,
        "start_day": null,
        "start_month": null,
        "start_year": 2010,
        "end_day": null,
        "end_month": null,
        "end_year": 2013
      },
      {
        "degree_level": "other",
        "degree_title": "journeyman's certificate, early dropout due to allergic reactions.",
        "completed": true,
        "institution": "SZ Rübkamp",
        "institution_city": "",
        "institution_state": "",
        "major": "Apprenticeship Cook",
        "concentration": null,
        "minor": null,
        "gpa": null,
        "gpa_scale": null,
        "start_day": null,
        "start_month": null,
        "start_year": 2009,
        "end_day": null,
        "end_month": null,
        "end_year": 2010
      },
      {
        "degree_level": "other",
        "degree_title": "vocational baccalaureate (completed practical part)",
        "completed": true,
        "institution": "FOS Delmestrasse",
        "institution_city": "",
        "institution_state": "",
        "major": "Social Pedagogy",
        "concentration": null,
        "minor": null,
        "gpa": null,
        "gpa_scale": null,
        "start_day": null,
        "start_month": null,
        "start_year": 2008,
        "end_day": null,
        "end_month": null,
        "end_year": 2009
      },
      {
        "degree_level": "other",
        "degree_title": "secondary school (certificate Real school)",
        "completed": true,
        "institution": "SZ Drebberstraße",
        "institution_city": "",
        "institution_state": "",
        "major": "Highschool",
        "concentration": null,
        "minor": null,
        "gpa": null,
        "gpa_scale": null,
        "start_day": null,
        "start_month": null,
        "start_year": 2002,
        "end_day": null,
        "end_month": null,
        "end_year": 2008
      }
    ],
    "experience": [
      {
        "title": "Full Stack Software Developer",
        "employer": "Tüfekci Software Development & Consulting",
        "employer_city": "Bremen",
        "employer_state": "",
        "employer_country": null,
        "description": [
          "Development of an Download Manager as a Prototype in PHP and than in Svelte",
          "Development of an Web Application for the Management of a Cleaning Company",
          "Development of an Web Application for the Management of an QR Code based Redirection System",
          "Development of Apps, Plugins, Wrappers and Apis for Deta.space",
          "Development of an Web Application which enables playing retro games in the Browser based on WASM Compiled Emulators.",
          "Development of an Android Application to read Web & Light Novels from different Providers in an unified UI.",
          "Development of an API & Crawler to build an index of Web & Light Novels from different Providers.",
          "Some Prototype ML/AI Applications which can generate Content, Images, Translate etc. which is used in different Projects."
        ]
      },
      {
        "title": "Cloud Development / Software Developer",
        "employer": "Freelance",
        "employer_city": "Remote",
        "employer_state": "",
        "employer_country": null,
        "description": [
          "Development of an Network Bridge between Web/Cloud to VisualBasic Application",
          "Development of an Application/API to automate Facebook Events",
          "Development of an APP for the Android and iOS Platform for Room Booking"
        ]
      },
      {
        "title": "Productowner",
        "employer": "RR Software GmbH",
        "employer_city": "Hasselfelde",
        "employer_state": "",
        "employer_country": null,
        "description": [
          "Planned and ReDesigned a Cloud/Web based Management System"
        ]
      },
      {
        "title": "Lead Web / Software Developer",
        "employer": "planetmutlu gmbh & co. kg",
        "employer_city": "Bremen",
        "employer_state": "",
        "employer_country": null,
        "description": [
          "Managed a 5-person development team",
          "Planned, Developed and Managed a booking, website and web2print system for cinemas (pmkino) using PhalconPHP, Wordpress, MongoDB, Python, NodeJS and ReactJS",
          "Developed a Web2Print solution using PhalconPHP, Wordpress, MongoDB, Python, NodeJS and ReactJS",
          "Developed a Wordpress Plugin and Theme environment for Messe Bremen Events, which was used in 10+ Websites."
        ]
      },
      {
        "title": "Freelance Full Stack Web Developer",
        "employer": "Tüfekci Software Development & Consulting",
        "employer_city": "Bremen",
        "employer_state": "",
        "employer_country": null,
        "description": []
      },
      {
        "title": "Lead IT Manager",
        "employer": "Humburg Media Group (Druckhaus Humburg)",
        "employer_city": "Bremen",
        "employer_state": "",
        "employer_country": null,
        "description": [
          "Managed a 4-person development team"
        ]
      },
      {
        "title": "Apprenticeship Media Designer",
        "employer": "image advertising gmbh & co. kg",
        "employer_city": "Bremen",
        "employer_state": "",
        "employer_country": null,
        "description": [
          "Implemented layouts and developed applications and websites using CakePHP, Joomla, and other related technologies."
        ]
      },
      {
        "title": "CTO & Co Founder",
        "employer": "SaveFM",
        "employer_city": "Bremen",
        "employer_state": "",
        "employer_country": null,
        "description": [
          "Designed and developed a desktop and mobile application using Node-Webkit and Phonegap that automatically records web radio streams and shares them via the cloud. Project terminated due to legal cost issues."
        ]
      },
      {
        "title": "Apprenticeship Cook",
        "employer": "Maritim Hotel Bremen",
        "employer_city": "Bremen",
        "employer_state": "",
        "employer_country": null,
        "description": [
          "The profession demanded creativity and I quite liked it, but unfortunately, I had to quit due to allergic reactions."
        ]
      },
      {
        "title": "Parttime Line Cook / Service Staff",
        "employer": "Maritim Hotel Bremen",
        "employer_city": "Bremen",
        "employer_state": "",
        "employer_country": null,
        "description": []
      },
      {
        "title": "Freelance Web Developer",
        "employer": "Tüfekci Software Development & Consulting",
        "employer_city": "Bremen",
        "employer_state": "",
        "employer_country": null,
        "description": []
      },
      {
        "title": "Parttime Cashier and Stocker",
        "employer": "ASG Supermarket",
        "employer_city": "Bremen",
        "employer_state": "",
        "employer_country": null,
        "description": []
      },
      {
        "title": "Parttime Cashier and Stocker",
        "employer": "GP (Getränke Partner)",
        "employer_city": "Bremen",
        "employer_state": "",
        "employer_country": null,
        "description": []
      }
    ],
    "projects": [
      {
        "title": "Client Projects (NDA)",
        "sub_title": "",
        "url": "",
        "description": [
          "Ongoing full-stack development, API design, cloud infrastructure, and software consulting for various clients. Details protected by non-disclosure agreements."
        ]
      },
      {
        "title": "LLM Applications & AI Integration",
        "sub_title": "",
        "url": "",
        "description": [
          "Development of applications and workflows leveraging large language models including local LLM deployment (ollama, llama.cpp), Open WebUI, RAG pipelines, prompt engineering, and API wrappers for multiple AI providers."
        ]
      },
      {
        "title": "AI Image Generation Pipeline",
        "sub_title": "",
        "url": "",
        "description": [